[32m[I 2023-09-10 11:22:30,391][0m A new study created in memory with name: no-name-7c991b4e-2244-4ce0-adf1-24b049927b48[0m
[32m[I 2023-09-10 11:22:31,503][0m Trial 0 finished with value: 0.0 and parameters: {'model': 'svm_linear', 'C': 0.4148710575856074}. Best is trial 0 with value: 0.0.[0m
[32m[I 2023-09-10 11:22:32,422][0m Trial 1 finished with value: 0.0 and parameters: {'model': 'svm_linear', 'C': 0.19332773620374044}. Best is trial 0 with value: 0.0.[0m
[32m[I 2023-09-10 11:22:32,467][0m Trial 2 finished with value: 0.0 and parameters: {'model': 'logistic', 'C': 0.20711534311490318}. Best is trial 0 with value: 0.0.[0m
[32m[I 2023-09-10 12:29:04,745][0m Trial 3 finished with value: 0.0 and parameters: {'model': 'svm_linear', 'C': 24.694145371512498}. Best is trial 0 with value: 0.0.[0m
[32m[I 2023-09-10 12:30:06,144][0m Trial 4 finished with value: 0.0 and parameters: {'model': 'svm_poly', 'C': 1.6596718546176976, 'degree': 13}. Best is trial 0 with value: 0.0.[0m
[32m[I 2023-09-10 12:30:06,195][0m Trial 5 finished with value: 0.0 and parameters: {'model': 'logistic', 'C': 0.3718020831653105}. Best is trial 0 with value: 0.0.[0m
[32m[I 2023-09-10 12:30:07,539][0m Trial 6 finished with value: 0.0 and parameters: {'model': 'svm_linear', 'C': 1.732017456400581}. Best is trial 0 with value: 0.0.[0m
[32m[I 2023-09-10 12:30:26,963][0m Trial 7 finished with value: 0.0 and parameters: {'model': 'svm_poly', 'C': 0.3626799246612604, 'degree': 9}. Best is trial 0 with value: 0.0.[0m
[32m[I 2023-09-10 12:31:00,900][0m Trial 8 finished with value: 0.0 and parameters: {'model': 'svm_poly', 'C': 3.940217327781623, 'degree': 11}. Best is trial 0 with value: 0.0.[0m
[32m[I 2023-09-10 12:31:00,941][0m Trial 9 finished with value: 0.0 and parameters: {'model': 'logistic', 'C': 3.723203571614154}. Best is trial 0 with value: 0.0.[0m
[32m[I 2023-09-10 12:31:03,083][0m Trial 10 finished with value: 0.0 and parameters: {'model': 'svm_rbf', 'C': 0.012316978225365515}. Best is trial 0 with value: 0.0.[0m
[32m[I 2023-09-10 12:31:04,059][0m Trial 11 finished with value: 0.0 and parameters: {'model': 'svm_linear', 'C': 0.06731085272532106}. Best is trial 0 with value: 0.0.[0m
[32m[I 2023-09-10 12:31:05,033][0m Trial 12 finished with value: 0.0 and parameters: {'model': 'svm_linear', 'C': 0.06171201486471089}. Best is trial 0 with value: 0.0.[0m
[32m[I 2023-09-10 12:47:03,329][0m Trial 13 finished with value: 0.0 and parameters: {'model': 'svm_linear', 'C': 72.46009142298443}. Best is trial 0 with value: 0.0.[0m
[32m[I 2023-09-10 12:47:06,195][0m Trial 14 finished with value: 0.0 and parameters: {'model': 'svm_rbf', 'C': 0.6751760808160444}. Best is trial 0 with value: 0.0.[0m
[32m[I 2023-09-10 12:47:07,193][0m Trial 15 finished with value: 0.0 and parameters: {'model': 'svm_linear', 'C': 0.09600310681574693}. Best is trial 0 with value: 0.0.[0m
[32m[I 2023-09-10 12:47:08,127][0m Trial 16 finished with value: 0.0 and parameters: {'model': 'svm_linear', 'C': 0.010972375096071687}. Best is trial 0 with value: 0.0.[0m
[32m[I 2023-09-10 12:47:09,110][0m Trial 17 finished with value: 0.0 and parameters: {'model': 'svm_linear', 'C': 0.17464098717701113}. Best is trial 0 with value: 0.0.[0m
[32m[I 2023-09-10 12:47:12,051][0m Trial 18 finished with value: 0.0 and parameters: {'model': 'svm_rbf', 'C': 0.8655541863614765}. Best is trial 0 with value: 0.0.[0m
[32m[I 2023-09-10 12:47:12,981][0m Trial 19 finished with value: 0.0 and parameters: {'model': 'svm_linear', 'C': 0.033350296180357925}. Best is trial 0 with value: 0.0.[0m
[32m[I 2023-09-10 12:47:13,958][0m Trial 20 finished with value: 0.0 and parameters: {'model': 'svm_linear', 'C': 0.1939527342345296}. Best is trial 0 with value: 0.0.[0m
[32m[I 2023-09-10 12:47:14,000][0m Trial 21 finished with value: 0.0 and parameters: {'model': 'logistic', 'C': 0.21055723777569083}. Best is trial 0 with value: 0.0.[0m
[32m[I 2023-09-10 12:47:14,045][0m Trial 22 finished with value: 0.0 and parameters: {'model': 'logistic', 'C': 0.5372381914907328}. Best is trial 0 with value: 0.0.[0m
[32m[I 2023-09-10 12:47:14,088][0m Trial 23 finished with value: 0.0 and parameters: {'model': 'logistic', 'C': 0.1690076898042765}. Best is trial 0 with value: 0.0.[0m
[32m[I 2023-09-10 12:47:14,121][0m Trial 24 finished with value: 0.0 and parameters: {'model': 'logistic', 'C': 0.03238440793072175}. Best is trial 0 with value: 0.0.[0m
[32m[I 2023-09-10 12:47:14,165][0m Trial 25 finished with value: 0.0 and parameters: {'model': 'logistic', 'C': 0.36221243700126227}. Best is trial 0 with value: 0.0.[0m
[32m[I 2023-09-10 12:47:16,709][0m Trial 26 finished with value: 0.0 and parameters: {'model': 'svm_rbf', 'C': 0.11823458765194354}. Best is trial 0 with value: 0.0.[0m
[32m[I 2023-09-10 12:47:21,160][0m Trial 27 finished with value: 0.0 and parameters: {'model': 'svm_poly', 'C': 0.31433335508672944, 'degree': 2}. Best is trial 0 with value: 0.0.[0m
[32m[I 2023-09-10 12:47:22,291][0m Trial 28 finished with value: 0.0 and parameters: {'model': 'svm_linear', 'C': 1.069747106812067}. Best is trial 0 with value: 0.0.[0m
[32m[I 2023-09-10 12:47:23,261][0m Trial 29 finished with value: 0.0 and parameters: {'model': 'svm_linear', 'C': 0.09068577729411192}. Best is trial 0 with value: 0.0.[0m
[32m[I 2023-09-10 12:47:23,318][0m Trial 30 finished with value: 0.0 and parameters: {'model': 'logistic', 'C': 8.994402020736898}. Best is trial 0 with value: 0.0.[0m
[32m[I 2023-09-10 13:45:05,837][0m Trial 31 finished with value: 0.0 and parameters: {'model': 'svm_linear', 'C': 18.72749294998075}. Best is trial 0 with value: 0.0.[0m
[32m[I 2023-09-10 13:45:06,841][0m Trial 32 finished with value: 0.0 and parameters: {'model': 'svm_linear', 'C': 1.0662051729058015}. Best is trial 0 with value: 0.0.[0m
[32m[I 2023-09-10 13:45:08,163][0m Trial 33 finished with value: 0.0 and parameters: {'model': 'svm_linear', 'C': 1.7799936980603077}. Best is trial 0 with value: 0.0.[0m
[32m[I 2023-09-10 13:45:13,565][0m Trial 34 finished with value: 0.0 and parameters: {'model': 'svm_poly', 'C': 0.5545128650867117, 'degree': 3}. Best is trial 0 with value: 0.0.[0m
[32m[I 2023-09-10 13:45:14,492][0m Trial 35 finished with value: 0.0 and parameters: {'model': 'svm_linear', 'C': 0.31510609908039305}. Best is trial 0 with value: 0.0.[0m
[32m[I 2023-09-10 13:45:23,879][0m Trial 36 finished with value: 0.0 and parameters: {'model': 'svm_poly', 'C': 2.0656447909543476, 'degree': 6}. Best is trial 0 with value: 0.0.[0m
[32m[I 2023-09-10 13:45:23,928][0m Trial 37 finished with value: 0.0 and parameters: {'model': 'logistic', 'C': 0.421245943295335}. Best is trial 0 with value: 0.0.[0m
[32m[I 2023-09-10 13:45:24,977][0m Trial 38 finished with value: 0.0 and parameters: {'model': 'svm_linear', 'C': 0.868560310507353}. Best is trial 0 with value: 0.0.[0m
[32m[I 2023-09-10 13:47:20,747][0m Trial 39 finished with value: 0.0 and parameters: {'model': 'svm_linear', 'C': 3.1861830787147474}. Best is trial 0 with value: 0.0.[0m
[32m[I 2023-09-10 13:47:23,243][0m Trial 40 finished with value: 0.0 and parameters: {'model': 'svm_rbf', 'C': 0.2822353088587886}. Best is trial 0 with value: 0.0.[0m
[32m[I 2023-09-10 13:48:39,922][0m Trial 41 finished with value: 0.0 and parameters: {'model': 'svm_poly', 'C': 7.100117394470203, 'degree': 14}. Best is trial 0 with value: 0.0.[0m
[32m[I 2023-09-10 13:50:07,024][0m Trial 42 finished with value: 0.03389830508474576 and parameters: {'model': 'svm_poly', 'C': 79.73698758466875, 'degree': 15}. Best is trial 42 with value: 0.03389830508474576.[0m
[32m[I 2023-09-10 13:52:09,168][0m Trial 43 finished with value: 0.03389830508474576 and parameters: {'model': 'svm_poly', 'C': 76.96767801333229, 'degree': 15}. Best is trial 42 with value: 0.03389830508474576.[0m
[32m[I 2023-09-10 13:53:49,218][0m Trial 44 finished with value: 0.03389830508474576 and parameters: {'model': 'svm_poly', 'C': 84.96702142127084, 'degree': 15}. Best is trial 42 with value: 0.03389830508474576.[0m
[32m[I 2023-09-10 13:55:26,099][0m Trial 45 finished with value: 0.03361344537815126 and parameters: {'model': 'svm_poly', 'C': 90.61187956571433, 'degree': 15}. Best is trial 42 with value: 0.03389830508474576.[0m
[32m[I 2023-09-10 13:57:04,491][0m Trial 46 finished with value: 0.03389830508474576 and parameters: {'model': 'svm_poly', 'C': 86.04671633081956, 'degree': 15}. Best is trial 42 with value: 0.03389830508474576.[0m
[32m[I 2023-09-10 13:59:15,439][0m Trial 47 finished with value: 0.03361344537815126 and parameters: {'model': 'svm_poly', 'C': 98.19666183827549, 'degree': 15}. Best is trial 42 with value: 0.03389830508474576.[0m
[32m[I 2023-09-10 14:01:02,253][0m Trial 48 finished with value: 0.03389830508474576 and parameters: {'model': 'svm_poly', 'C': 58.789138593273876, 'degree': 15}. Best is trial 42 with value: 0.03389830508474576.[0m
[32m[I 2023-09-10 14:03:17,818][0m Trial 49 finished with value: 0.03333333333333333 and parameters: {'model': 'svm_poly', 'C': 56.1956379175064, 'degree': 15}. Best is trial 42 with value: 0.03389830508474576.[0m
[32m[I 2023-09-10 14:04:59,481][0m Trial 50 finished with value: 0.034482758620689655 and parameters: {'model': 'svm_poly', 'C': 49.10845504441531, 'degree': 13}. Best is trial 50 with value: 0.034482758620689655.[0m
[32m[I 2023-09-10 14:06:26,410][0m Trial 51 finished with value: 0.034482758620689655 and parameters: {'model': 'svm_poly', 'C': 47.41208697238924, 'degree': 13}. Best is trial 50 with value: 0.034482758620689655.[0m
[32m[I 2023-09-10 14:07:29,154][0m Trial 52 finished with value: 0.034482758620689655 and parameters: {'model': 'svm_poly', 'C': 47.55145468067789, 'degree': 12}. Best is trial 50 with value: 0.034482758620689655.[0m
[32m[I 2023-09-10 14:08:27,487][0m Trial 53 finished with value: 0.034482758620689655 and parameters: {'model': 'svm_poly', 'C': 37.699851802857374, 'degree': 12}. Best is trial 50 with value: 0.034482758620689655.[0m
[32m[I 2023-09-10 14:09:41,459][0m Trial 54 finished with value: 0.034482758620689655 and parameters: {'model': 'svm_poly', 'C': 40.544699759384066, 'degree': 12}. Best is trial 50 with value: 0.034482758620689655.[0m
[32m[I 2023-09-10 14:11:08,566][0m Trial 55 finished with value: 0.034482758620689655 and parameters: {'model': 'svm_poly', 'C': 38.89450122374399, 'degree': 12}. Best is trial 50 with value: 0.034482758620689655.[0m
[32m[I 2023-09-10 14:12:11,499][0m Trial 56 finished with value: 0.034482758620689655 and parameters: {'model': 'svm_poly', 'C': 40.439450099721846, 'degree': 12}. Best is trial 50 with value: 0.034482758620689655.[0m
[32m[I 2023-09-10 14:13:05,729][0m Trial 57 finished with value: 0.034482758620689655 and parameters: {'model': 'svm_poly', 'C': 29.553301328411784, 'degree': 11}. Best is trial 50 with value: 0.034482758620689655.[0m
[32m[I 2023-09-10 14:14:10,365][0m Trial 58 finished with value: 0.034482758620689655 and parameters: {'model': 'svm_poly', 'C': 39.28242887746973, 'degree': 12}. Best is trial 50 with value: 0.034482758620689655.[0m
[32m[I 2023-09-10 14:15:24,749][0m Trial 59 finished with value: 0.034482758620689655 and parameters: {'model': 'svm_poly', 'C': 20.863450160855763, 'degree': 12}. Best is trial 50 with value: 0.034482758620689655.[0m
[32m[I 2023-09-10 14:16:04,229][0m Trial 60 finished with value: 0.034482758620689655 and parameters: {'model': 'svm_poly', 'C': 17.293782235116872, 'degree': 10}. Best is trial 50 with value: 0.034482758620689655.[0m
[32m[I 2023-09-10 14:17:23,870][0m Trial 61 finished with value: 0.034482758620689655 and parameters: {'model': 'svm_poly', 'C': 41.333422986689506, 'degree': 13}. Best is trial 50 with value: 0.034482758620689655.[0m
[32m[I 2023-09-10 14:18:37,546][0m Trial 62 finished with value: 0.034482758620689655 and parameters: {'model': 'svm_poly', 'C': 30.10008316429926, 'degree': 12}. Best is trial 50 with value: 0.034482758620689655.[0m
[32m[I 2023-09-10 14:20:17,505][0m Trial 63 finished with value: 0.034482758620689655 and parameters: {'model': 'svm_poly', 'C': 48.17606727218512, 'degree': 13}. Best is trial 50 with value: 0.034482758620689655.[0m
[32m[I 2023-09-10 14:21:03,002][0m Trial 64 finished with value: 0.034482758620689655 and parameters: {'model': 'svm_poly', 'C': 34.24121813140231, 'degree': 11}. Best is trial 50 with value: 0.034482758620689655.[0m
[32m[I 2023-09-10 14:22:26,090][0m Trial 65 finished with value: 0.034188034188034185 and parameters: {'model': 'svm_poly', 'C': 57.66240206124092, 'degree': 13}. Best is trial 50 with value: 0.034482758620689655.[0m
[32m[I 2023-09-10 14:23:19,865][0m Trial 66 finished with value: 0.034188034188034185 and parameters: {'model': 'svm_poly', 'C': 23.93374935086968, 'degree': 12}. Best is trial 50 with value: 0.034482758620689655.[0m
[32m[I 2023-09-10 14:23:59,776][0m Trial 67 finished with value: 0.05128205128205128 and parameters: {'model': 'svm_poly', 'C': 35.36795732755993, 'degree': 10}. Best is trial 67 with value: 0.05128205128205128.[0m
[32m[I 2023-09-10 14:24:38,350][0m Trial 68 finished with value: 0.034482758620689655 and parameters: {'model': 'svm_poly', 'C': 15.217697896184413, 'degree': 10}. Best is trial 67 with value: 0.05128205128205128.[0m
[32m[I 2023-09-10 14:25:52,543][0m Trial 69 finished with value: 0.03361344537815126 and parameters: {'model': 'svm_poly', 'C': 27.75763863973854, 'degree': 13}. Best is trial 67 with value: 0.05128205128205128.[0m
[32m[I 2023-09-10 14:25:58,845][0m Trial 70 finished with value: 0.0 and parameters: {'model': 'svm_rbf', 'C': 60.89117353428577}. Best is trial 67 with value: 0.05128205128205128.[0m
[32m[I 2023-09-10 14:26:59,671][0m Trial 71 finished with value: 0.034482758620689655 and parameters: {'model': 'svm_poly', 'C': 46.96575044010306, 'degree': 12}. Best is trial 67 with value: 0.05128205128205128.[0m
[32m[I 2023-09-10 14:27:27,417][0m Trial 72 finished with value: 0.05128205128205128 and parameters: {'model': 'svm_poly', 'C': 36.89449750909672, 'degree': 8}. Best is trial 67 with value: 0.05128205128205128.[0m
[32m[I 2023-09-10 14:27:47,422][0m Trial 73 finished with value: 0.05128205128205128 and parameters: {'model': 'svm_poly', 'C': 35.23433410077985, 'degree': 7}. Best is trial 67 with value: 0.05128205128205128.[0m
[32m[I 2023-09-10 14:28:08,581][0m Trial 74 finished with value: 0.03508771929824561 and parameters: {'model': 'svm_poly', 'C': 23.603246513024622, 'degree': 7}. Best is trial 67 with value: 0.05128205128205128.[0m
[32m[I 2023-09-10 14:28:25,945][0m Trial 75 finished with value: 0.034782608695652174 and parameters: {'model': 'svm_poly', 'C': 25.15986916903844, 'degree': 7}. Best is trial 67 with value: 0.05128205128205128.[0m
[32m[I 2023-09-10 14:28:46,388][0m Trial 76 finished with value: 0.034782608695652174 and parameters: {'model': 'svm_poly', 'C': 25.319672180057825, 'degree': 7}. Best is trial 67 with value: 0.05128205128205128.[0m
[32m[I 2023-09-10 14:29:04,680][0m Trial 77 finished with value: 0.0 and parameters: {'model': 'svm_poly', 'C': 13.45373852305024, 'degree': 7}. Best is trial 67 with value: 0.05128205128205128.[0m
[32m[I 2023-09-10 14:29:24,203][0m Trial 78 finished with value: 0.03508771929824561 and parameters: {'model': 'svm_poly', 'C': 23.21259100811158, 'degree': 7}. Best is trial 67 with value: 0.05128205128205128.[0m
[32m[I 2023-09-10 14:29:47,260][0m Trial 79 finished with value: 0.034782608695652174 and parameters: {'model': 'svm_poly', 'C': 25.083371038002426, 'degree': 7}. Best is trial 67 with value: 0.05128205128205128.[0m
[32m[I 2023-09-10 14:29:51,660][0m Trial 80 finished with value: 0.0 and parameters: {'model': 'svm_rbf', 'C': 21.76238137125605}. Best is trial 67 with value: 0.05128205128205128.[0m
[32m[I 2023-09-10 14:30:13,178][0m Trial 81 finished with value: 0.034782608695652174 and parameters: {'model': 'svm_poly', 'C': 27.930088723518402, 'degree': 7}. Best is trial 67 with value: 0.05128205128205128.[0m
[32m[I 2023-09-10 14:30:28,137][0m Trial 82 finished with value: 0.0 and parameters: {'model': 'svm_poly', 'C': 12.716723511354852, 'degree': 7}. Best is trial 67 with value: 0.05128205128205128.[0m
[32m[I 2023-09-10 14:30:45,884][0m Trial 83 finished with value: 0.034782608695652174 and parameters: {'model': 'svm_poly', 'C': 25.840707035832914, 'degree': 7}. Best is trial 67 with value: 0.05128205128205128.[0m
[32m[I 2023-09-10 14:31:09,382][0m Trial 84 finished with value: 0.03508771929824561 and parameters: {'model': 'svm_poly', 'C': 18.996267861990713, 'degree': 8}. Best is trial 67 with value: 0.05128205128205128.[0m
[32m[I 2023-09-10 14:31:31,737][0m Trial 85 finished with value: 0.03508771929824561 and parameters: {'model': 'svm_poly', 'C': 20.91644223675659, 'degree': 8}. Best is trial 67 with value: 0.05128205128205128.[0m
[32m[I 2023-09-10 14:31:55,691][0m Trial 86 finished with value: 0.03508771929824561 and parameters: {'model': 'svm_poly', 'C': 17.856582647757403, 'degree': 8}. Best is trial 67 with value: 0.05128205128205128.[0m
[32m[I 2023-09-10 14:32:16,813][0m Trial 87 finished with value: 0.03508771929824561 and parameters: {'model': 'svm_poly', 'C': 17.774798486202926, 'degree': 8}. Best is trial 67 with value: 0.05128205128205128.[0m
[32m[I 2023-09-10 14:32:40,225][0m Trial 88 finished with value: 0.0 and parameters: {'model': 'svm_poly', 'C': 10.347887794917066, 'degree': 8}. Best is trial 67 with value: 0.05128205128205128.[0m
[32m[I 2023-09-10 14:32:40,269][0m Trial 89 finished with value: 0.0 and parameters: {'model': 'logistic', 'C': 18.456267679392784}. Best is trial 67 with value: 0.05128205128205128.[0m
[32m[I 2023-09-10 14:33:05,091][0m Trial 90 finished with value: 0.03508771929824561 and parameters: {'model': 'svm_poly', 'C': 16.60204630099902, 'degree': 8}. Best is trial 67 with value: 0.05128205128205128.[0m
[32m[I 2023-09-10 14:33:28,044][0m Trial 91 finished with value: 0.03508771929824561 and parameters: {'model': 'svm_poly', 'C': 17.63923177676517, 'degree': 8}. Best is trial 67 with value: 0.05128205128205128.[0m
[32m[I 2023-09-10 14:33:55,638][0m Trial 92 finished with value: 0.034482758620689655 and parameters: {'model': 'svm_poly', 'C': 15.375500570593008, 'degree': 9}. Best is trial 67 with value: 0.05128205128205128.[0m
[32m[I 2023-09-10 14:34:06,827][0m Trial 93 finished with value: 0.0 and parameters: {'model': 'svm_poly', 'C': 11.06206019958468, 'degree': 5}. Best is trial 67 with value: 0.05128205128205128.[0m
[32m[I 2023-09-10 14:34:36,548][0m Trial 94 finished with value: 0.03508771929824561 and parameters: {'model': 'svm_poly', 'C': 19.714029607185235, 'degree': 8}. Best is trial 67 with value: 0.05128205128205128.[0m
[32m[I 2023-09-10 14:35:03,840][0m Trial 95 finished with value: 0.05128205128205128 and parameters: {'model': 'svm_poly', 'C': 33.998074230716725, 'degree': 6}. Best is trial 67 with value: 0.05128205128205128.[0m
[32m[I 2023-09-10 14:35:31,188][0m Trial 96 finished with value: 0.05128205128205128 and parameters: {'model': 'svm_poly', 'C': 32.31131506007126, 'degree': 6}. Best is trial 67 with value: 0.05128205128205128.[0m
[32m[I 2023-09-10 14:35:46,341][0m Trial 97 finished with value: 0.03508771929824561 and parameters: {'model': 'svm_poly', 'C': 31.244956519046422, 'degree': 5}. Best is trial 67 with value: 0.05128205128205128.[0m
[32m[I 2023-09-10 14:35:52,514][0m Trial 98 finished with value: 0.0 and parameters: {'model': 'svm_rbf', 'C': 67.68296585113475}. Best is trial 67 with value: 0.05128205128205128.[0m
[32m[I 2023-09-10 14:36:18,919][0m Trial 99 finished with value: 0.05128205128205128 and parameters: {'model': 'svm_poly', 'C': 34.51746113379802, 'degree': 6}. Best is trial 67 with value: 0.05128205128205128.[0m
Loading pretrained network
Creating dataset
putting data trough network
Creating behave dataset
calculating F1 score on atmouth action
%%%%% On y_hat %%%%%
normalizing data
running tuna study on metric
Best Hyperparameters from Optuna: {'model': 'svm_poly', 'C': 35.36795732755993, 'degree': 10}
Best Validation Set Accuracy: 0.05128205128205128
Test Set Accuracy: 0.0
Test Set Accuracy: 0.0
Test Set Accuracy: 0.0
Test Set Accuracy: 0.03225806451612903
Test Set Accuracy: 0.0
Test Set Accuracy: 0.0
Test Set Accuracy: 0.0
Test Set Accuracy: 0.0
Test Set Accuracy: 0.0
Test Set Accuracy: 0.017241379310344827
[0.0049499443826473855]
